{
  "kind": "seevee.comments",
  "schemaVersion": "1.0.0",
  "id": "comments_demo",
  "revision": 0,
  "createdAt": "2026-09-23T00:00:00.000Z",
  "updatedAt": "2026-09-23T00:00:00.000Z",
  "data": {
    "threadOrder": [
      "thr_demo"
    ],
    "threads": {
      "thr_demo": {
        "id": "thr_demo",
        "category": "copy",
        "priority": "normal",
        "status": "open",
        "target": {
          "source": {
            "resource": "cv",
            "resourceId": "cv_demo",
            "revisionAtCreation": 0
          },
          "selectors": [
            {
              "type": "FieldSelector",
              "nodeId": "bul_demo",
              "nodeType": "bullet",
              "field": "/text"
            },
            {
              "type": "TextQuoteSelector",
              "exact": "Built internal developer tooling for repeated engineering workflows.",
              "prefix": "",
              "suffix": "",
              "normalization": "unicode-nfc-whitespace"
            },
            {
              "type": "PageRegionSelector",
              "page": 1,
              "x": 0.12,
              "y": 0.38,
              "width": 0.68,
              "height": 0.05,
              "renderContext": {
                "cvRevision": 0,
                "presentationRevision": 0,
                "templateVersionId": "tplv_minimal_1"
              }
            }
          ],
          "extensions": {}
        },
        "messageOrder": [
          "msg_demo"
        ],
        "messages": {
          "msg_demo": {
            "id": "msg_demo",
            "author": {
              "type": "user",
              "id": "user_local"
            },
            "body": "Make this bullet more specific, but do not invent a metric.",
            "createdAt": "2026-09-23T00:00:00.000Z",
            "supersedesMessageId": null,
            "extensions": {}
          }
        },
        "agentWork": {
          "state": "pending",
          "claimedByRunId": null,
          "changeSetIds": [],
          "lastError": null
        },
        "resolution": null,
        "createdAt": "2026-09-23T00:00:00.000Z",
        "updatedAt": "2026-09-23T00:00:00.000Z",
        "extensions": {}
      }
    },
    "extensions": {}
  }
}
